item_id,verb,subject_condition,subject,context_condition,context,predicate_condition,predicate,Preamble,prefix,CriticalWord,intervention_simple,continuation,aux,verb_1_o,sentence,question,condition_id,item,verb_condition,subject_context_condition,list_id
1_random_neutral_context2,artled,neutral,he,context2,"in the candy shop, ",1,ball,"in the candy shop, he","in the candy shop, he artled the",artled,the,ball,Did,kick,"in the candy shop, he artled the ball",Did he kick the ball?,random_neutral_context2,1,random,neutral_context2,23
2_word1_subject1_nocontext,is taking,subject1,the photographer,nocontext,,1,photo,the photographer,the photographer is taking a,is taking,a,photo,Is,taking,the photographer is taking a photo,Is the photographer taking a photo?,word1_subject1_nocontext,2,word1,subject1_nocontext,23
3_word2_subject2_nocontext,bent,subject2,the gymnast,nocontext,,1,letter,the gymnast,the gymnast bent his,bent,his,letter,Did,send,the gymnast bent his letter,Did the gymnast send his letter?,word2_subject2_nocontext,3,word2,subject2_nocontext,23
4_word2_control_neutral_nocontext,pressed,neutral,he,nocontext,,1,song,he,he pressed the,pressed,the,song,Did,sing,he pressed the song,Did he sing the song?,word2_control_neutral_nocontext,4,word2_control,neutral_nocontext,23
5_nonword_neutral_context1,is zeading,neutral,he,context1,"in the library, ",1,book,"in the library, he","in the library, he is zeading the",is zeading,the,book,Is,reading,"in the library, he is zeading the book",Is he reading the book?,nonword_neutral_context1,5,nonword,neutral_context1,23
6_random_neutral_context2,galuses,neutral,he,context2,"at the fashion studio, ",1,meeting,"at the fashion studio, he","at the fashion studio, he galuses a",galuses,a,meeting,Does,hold,"at the fashion studio, he galuses a meeting",Does he hold a meeting?,random_neutral_context2,6,random,neutral_context2,23
7_word1_subject1_nocontext,saved,subject1,the firefighter,nocontext,,1,person,the firefighter,the firefighter saved a,saved,a,person,Did,save,the firefighter saved a person,Did the firefighter save a person?,word1_subject1_nocontext,7,word1,subject1_nocontext,23
8_word2_subject2_nocontext,is picking,subject2,the gardener,nocontext,,1,bag,the gardener,the gardener is picking the,is picking,the,bag,Is,packing,the gardener is picking the bag,Is the gardener packing the bag?,word2_subject2_nocontext,8,word2,subject2_nocontext,23
9_word2_control_neutral_nocontext,passed,neutral,he,nocontext,,1,tank,he,he passed the,passed,the,tank,Is,filling,he passed the tank,Is he filling the tank?,word2_control_neutral_nocontext,9,word2_control,neutral_nocontext,23
10_nonword_neutral_context1,iides,neutral,he,context1,"in the park, ",1,bike,"in the park, he","in the park, he iides a",iides,a,bike,Does,ride,"in the park, he iides a bike",Does he ride a bike?,nonword_neutral_context1,10,nonword,neutral_context1,23
11_random_neutral_context2,phrneys,neutral,he,context2,"on a game show, ",1,door,"on a game show, he","on a game show, he phrneys the",phrneys,the,door,Does,pull,"on a game show, he phrneys the door",Does he pull the door?,random_neutral_context2,11,random,neutral_context2,23
12_word1_subject1_nocontext,dried,subject1,the maid,nocontext,,1,clothes,the maid,the maid dried the,dried,the,clothes,Did,dry,the maid dried the clothes,Did the maid dry the clothes?,word1_subject1_nocontext,12,word1,subject1_nocontext,23
13_word2_subject2_nocontext,mailed,subject2,the sender,nocontext,,1,exam,the sender,the sender mailed the,mailed,the,exam,Did,fail,the sender mailed the exam,Did the sender fail the exam?,word2_subject2_nocontext,13,word2,subject2_nocontext,23
14_word2_control_neutral_nocontext,dismissed,neutral,he,nocontext,,1,lawsuit,he,he dismissed the,dismissed,the,lawsuit,Did,file,he dismissed the lawsuit,Did he file the lawsuit?,word2_control_neutral_nocontext,14,word2_control,neutral_nocontext,23
15_nonword_neutral_context1,aows,neutral,he,context1,"on the river, ",1,boat,"on the river, he","on the river, he aows the",aows,the,boat,Does,row,"on the river, he aows the boat",Does he row the boat?,nonword_neutral_context1,15,nonword,neutral_context1,23
16_random_neutral_context2,nokers,neutral,he,context2,"at the market, ",1,bottle,"at the market, he","at the market, he nokers the",nokers,the,bottle,Does,seal,"at the market, he nokers the bottle",Does he seal the bottle?,random_neutral_context2,16,random,neutral_context2,23
17_word1_subject1_nocontext,battled,subject1,the soldier,nocontext,,1,enemy,the soldier,the soldier battled the,battled,the,enemy,Did,battle,the soldier battled the enemy,Did the soldier battle the enemy?,word1_subject1_nocontext,17,word1,subject1_nocontext,23
18_word2_subject2_nocontext,relieved,subject2,the therapist,nocontext,,1,claim,the therapist,the therapist relieved her,relieved,her,claim,Did,believe,the therapist relieved her claim,Did the therapist believe her claim?,word2_subject2_nocontext,18,word2,subject2_nocontext,23
19_word2_control_neutral_nocontext,murdered,neutral,he,nocontext,,1,client,he,he murdered the,murdered,the,client,Did,bill,he murdered the client,Did he bill the client?,word2_control_neutral_nocontext,19,word2_control,neutral_nocontext,23
20_nonword_neutral_context1,iites,neutral,he,context1,"when writing a paper, ",1,study,"when writing a paper, he","when writing a paper, he iites the",iites,the,study,Does,cite,"when writing a paper, he iites the study",Does he cite the study?,nonword_neutral_context1,20,nonword,neutral_context1,23
21_random_neutral_context2,kapsed,neutral,he,context2,"in the battlefield, ",1,file,"in the battlefield, he","in the battlefield, he kapsed the",kapsed,the,file,Did,attach,"in the battlefield, he kapsed the file",Did he attach the file?,random_neutral_context2,21,random,neutral_context2,23
22_word1_subject1_nocontext,earns,subject1,the investor,nocontext,,1,fortune,the investor,the investor earns a,earns,a,fortune,Does,earn,the investor earns a fortune,Does the investor earn a fortune?,word1_subject1_nocontext,22,word1,subject1_nocontext,23
23_word2_subject2_nocontext,dumped,subject2,the cleaner,nocontext,,1,car,the cleaner,the cleaner dumped the,dumped,the,car,Does,bump,the cleaner dumped the car,Does the cleaner bump the car?,word2_subject2_nocontext,23,word2,subject2_nocontext,23
24_word2_control_neutral_nocontext,shut,neutral,he,nocontext,,1,gene,he,he shut the,shut,the,gene,Did,clone,he shut the gene,Did he clone the gene?,word2_control_neutral_nocontext,24,word2_control,neutral_nocontext,23
25_nonword_neutral_context1,vocks,neutral,he,context1,"at the harbor, ",1,boat,"at the harbor, he","at the harbor, he vocks the",vocks,the,boat,Does,dock,"at the harbor, he vocks the boat",Does he dock the boat?,nonword_neutral_context1,25,nonword,neutral_context1,23
26_random_neutral_context2,prizstanded,neutral,he,context2,"at the board meeting, ",1,game,"at the board meeting, he","at the board meeting, he prizstanded the",prizstanded,the,game,Did,dominate,"at the board meeting, he prizstanded the game",Did he dominate the game?,random_neutral_context2,26,random,neutral_context2,23
27_word1_subject1_nocontext,draws,subject1,the player,nocontext,,1,card,the player,the player draws the,draws,the,card,Does,draw,the player draws the card,Does the player draw the card?,word1_subject1_nocontext,27,word1,subject1_nocontext,23
28_word2_subject2_nocontext,grills,subject2,the chef,nocontext,,1,wood,the chef,the chef grills the,grills,the,wood,Does,drill,the chef grills the wood,Does the chef drill the wood?,word2_subject2_nocontext,28,word2,subject2_nocontext,23
29_word2_control_neutral_nocontext,assessed,neutral,he,nocontext,,1,building,he,he assessed the,assessed,the,building,Did,evacuate,he assessed the building,Did he evacuate the building?,word2_control_neutral_nocontext,29,word2_control,neutral_nocontext,23
30_nonword_neutral_context1,deased,neutral,he,context1,"at the dog park, ",1,puppy,"at the dog park, he","at the dog park, he deased the",deased,the,puppy,Did,tease,"at the dog park, he deased the puppy",Did he tease the puppy?,nonword_neutral_context1,30,nonword,neutral_context1,23
31_random_neutral_context2,jabcted,neutral,he,context2,"in a forest clearing, ",1,pants,"in a forest clearing, he","in a forest clearing, he jabcted the",jabcted,the,pants,Did,patch,"in a forest clearing, he jabcted the pants",Did he patch the pants?,random_neutral_context2,31,random,neutral_context2,23
32_word1_subject1_nocontext,pricked,subject1,the careless kid,nocontext,,1,finger,the careless kid,the careless kid pricked his,pricked,his,finger,Did,prick,the careless kid pricked his finger,Did the careless kid prick his finger?,word1_subject1_nocontext,32,word1,subject1_nocontext,23
33_word2_subject2_nocontext,revised,subject2,the editor,nocontext,,1,patient,the editor,the editor revised the,revised,the,patient,Did,revive,the editor revised the patient,Did the editor revive the patient?,word2_subject2_nocontext,33,word2,subject2_nocontext,23
34_word2_control_neutral_nocontext,sends,neutral,he,nocontext,,1,class,he,he sends the,sends,the,class,Does,skip,he sends the class,Does he skip the class?,word2_control_neutral_nocontext,34,word2_control,neutral_nocontext,23
35_nonword_neutral_context1,tnpped,neutral,he,context1,"after enjoying the meal, ",1,waiter,"after enjoying the meal, he","after enjoying the meal, he tnpped the",tnpped,the,waiter,Does,tip,"after enjoying the meal, he tnpped the waiter",Does he tip the waiter?,nonword_neutral_context1,35,nonword,neutral_context1,23
